{
  "schema_version": "mathgraph.finite-profile-input.v1",
  "profile": "mathgraph.finite-representation-refinement.v1",
  "scope": "Exactly the eight ordered 3-bit states; deterministic Boolean policies on observational cells; the fixed five named refinements and all 256 Boolean one-bit refinements; discovery bit0 AND parity and reuse bit0 OR parity.",
  "states": [
    [
      0,
      0,
      0
    ],
    [
      0,
      0,
      1
    ],
    [
      0,
      1,
      0
    ],
    [
      0,
      1,
      1
    ],
    [
      1,
      0,
      0
    ],
    [
      1,
      0,
      1
    ],
    [
      1,
      1,
      0
    ],
    [
      1,
      1,
      1
    ]
  ],
  "features": {
    "parity": [
      0,
      1,
      1,
      0,
      1,
      0,
      0,
      1
    ],
    "bit0": [
      0,
      0,
      0,
      0,
      1,
      1,
      1,
      1
    ],
    "bit1": [
      0,
      0,
      1,
      1,
      0,
      0,
      1,
      1
    ],
    "bit2": [
      0,
      1,
      0,
      1,
      0,
      1,
      0,
      1
    ],
    "weight": [
      0,
      1,
      1,
      2,
      1,
      2,
      2,
      3
    ],
    "constant_zero": [
      0,
      0,
      0,
      0,
      0,
      0,
      0,
      0
    ]
  },
  "targets": {
    "discovery": {
      "source": "experiments/developmental_capability_growth_v1/run.py#target_discovery",
      "vector": [
        0,
        0,
        0,
        0,
        1,
        0,
        0,
        1
      ]
    },
    "reuse": {
      "source": "experiments/developmental_capability_growth_v1/run.py#target_transfer",
      "vector": [
        0,
        1,
        1,
        0,
        1,
        1,
        1,
        1
      ]
    }
  },
  "baseline_features": [
    "parity"
  ],
  "named_family": [
    "bit0",
    "bit1",
    "bit2",
    "weight",
    "constant_zero"
  ],
  "selected_refinement": "bit0",
  "sham_refinement": "bit1",
  "refined_features": [
    "parity",
    "bit0"
  ],
  "ablated_features": [
    "parity"
  ],
  "retained_targets": [
    [
      0,
      0,
      0,
      0,
      0,
      0,
      0,
      0
    ],
    [
      1,
      0,
      0,
      1,
      0,
      1,
      1,
      0
    ],
    [
      0,
      1,
      1,
      0,
      1,
      0,
      0,
      1
    ],
    [
      1,
      1,
      1,
      1,
      1,
      1,
      1,
      1
    ]
  ],
  "coverage": {
    "policy_masks": [
      0,
      256
    ],
    "refinement_masks": [
      0,
      256
    ]
  }
}
